"SourceName","Title","Description","Url","UrlToImage","PublishedAt"
"Livemint.com","Coronavirus impact: India issues telemedicine guidelines - Livemint","Telemedicine will enable doctors to prescribe medicines based on telephone, reducing risks of transmission for healthcare workers and patients","https://www.livemint.com/news/india/coronavirus-impact-india-issues-telemedicine-guidelines-11585219592726.html","https://images.livemint.com/img/2020/03/26/600x338/rara-kfpG--621x414@LiveMint_1585222313829.jpg","2020-03-26T11:34:10Z"
"Nytimes.com","Can You Become Immune To The Coronavirus? - Forbes India","It's likely you can, at least for some period of time. That is opening new opportunities for testing and treatment","https://www.nytimes.com/2020/03/25/health/coronavirus-immunity-antibodies.html","https://www.forbesindia.com/media/images/2020/Mar/img_130283_coronavirusimmunitys.jpg","2020-03-26T07:53:22Z"
"Theprint.in","ICMR answers Covid-19 related queries for people with hypertension, diabetes, heart diseases - ThePrint","ICMR, the country apex medical research body, has answered a list of FAQs on the novel coronavirus that infected more than 600 in India.","https://theprint.in/health/icmr-answers-covid-19-related-queries-for-people-with-hypertension-diabetes-heart-diseases/388601/","https://d2c7ipcroan06u.cloudfront.net/wp-content/uploads/2020/03/Masks-1.jpg","2020-03-26T07:35:40Z"
"Indiatoday.in","Coronavirus: Who should wear face mask; do they stop Covid-19 spread | Explainer - India Today","Close-fitting masks, such as N95 ones, can offer good, but not total protection against infectious droplets, while the next rank up, the N99-rated masks can give better protection, but some find them difficult to breathe through.","https://www.indiatoday.in/world/story/coronavirus-who-should-wear-face-mask-do-they-stop-covid-19-spread-explainer-1659771-2020-03-26","https://akm-img-a-in.tosshub.com/indiatoday/images/story/202003/maskswors-647x363.jpeg?sPjyfveFYydatQzYIqFpf_N5v0KCecu9","2020-03-25T23:21:39Z"
"Youtube.com","Coronavirus: Don't Use Hydroxychloroquine Without Prescription - India Today","While coronavirus panic spreads across the country, the Union Health Ministry has one strict advice -- do not take the anti-malarial drug hydroxychloroquine ...","https://www.youtube.com/watch?v=DzqouCv8qJ8","https://i.ytimg.com/vi/DzqouCv8qJ8/maxresdefault.jpg","2020-03-25T16:54:59Z"
"Telegraph.co.uk","British pensioners plead for Foreign Office rescue from Indian hospital quarantine - Telegraph.co.uk","Five elderly British tourists being held in &lsquo;extremely poor conditions&rsquo; in an Indian quarantine facility after testing positive for coronavirus have pleaded with the Foreign and Commonwealth Office (FCO) to do more to help them.","https://www.telegraph.co.uk/news/2020/03/25/british-pensioners-plead-foreign-office-rescue-indian-hospital/","https://www.telegraph.co.uk/content/dam/news/2020/03/25/steve-hancock-and-ann-williams-xlarge_trans_NvBQzQNjv4BqEDjTm7JpzhSGR1_8ApEWQA1vLvhkMtVb21dMmpQBfEs.jpg?imwidth=1200","2020-03-25T16:22:00Z"
