"SourceName","Title","Description","Url","UrlToImage","PublishedAt"
"Thestatesman.com","‘Latitude link’ in Coronavirus spread; new cases in India could surge: IMSC Study - The Statesman","More findings on the latitudinal link to the spread of the virus may also help authorities customise their response and assist in preventing its dispersion, Prof Sitabhra Sinha said.","https://www.thestatesman.com/india/latitude-link-in-coronavirus-spread-new-cases-in-india-could-surge-imsc-study-1502868690.html","https://www.thestatesman.com/wp-content/uploads/2020/03/covid.jpg","2020-03-22T15:43:39Z"
"Indianexpress.com","Bill Gates to Jack Ma, how billionaires are helping in the fight against coronavirus - The Indian Express","We are listing down the commitments or donations announced by the billionaires worldwide to help aid the fight against the coronavirus pandemic.","https://indianexpress.com/article/technology/tech-news-technology/bill-gates-to-jack-ma-how-billionaires-are-helping-in-the-fight-against-coronavirus-6326819/","https://images.indianexpress.com/2020/03/bil-gates.jpg?w=759","2020-03-22T13:10:42Z"
"The Times of India","What to expect when you get tested for Coronavirus - Times of India","The process is slightly invasive and uncomfortable but is quick and simple. A long Q-tip is inserted through the no","https://timesofindia.indiatimes.com/life-style/health-fitness/health-news/what-to-expect-when-you-get-tested-for-coronavirus/articleshow/74755927.cms","https://static.toiimg.com/photo/msid-74755910/74755910.jpg?48069","2020-03-22T10:19:28Z"
"Indiatvnews.com","COVID-19 Pandemic: Novel coronavirus stays for a day on cardboard & 3 days on plastic, says Study - India TV News","The novel coronavirus, responsible for the COVID-19 pandemic, can stay for up to 24 hours on cardboard. coronavirus india, coronavirus lifespan, coronavirus lifecycle, coronavirus life, coronavirus life outside body, coronavirus life on surfaces, coronavirus,…","https://www.indiatvnews.com/science/covid-19-pandemic-how-long-novel-coronavirus-live-on-surfaces-coronavirus-lifespan-600433","https://resize.indiatvnews.com/en/resize/newbucket/715_-/2020/03/pjimage-7-1584849806.jpg","2020-03-22T07:28:24Z"
"Indiatvnews.com","4 potential treatments that can save world from Coronavirus - India TV News","The world is warped under the deadly coronavirus and till now we have nothing substantial to cure or prevent the people from this novel. Researchers are hard at work developing potential treatments or vaccines for the virus.","https://www.indiatvnews.com/science/coronavirus-pandemic-cure-drugs-scientists-covid-19-600404","https://resize.indiatvnews.com/en/resize/newbucket/715_-/2020/03/coronavirusap-1584853309.jpg","2020-03-22T05:48:01Z"
"Indicanews.com","US FDA to lift band on two IPCA plants in India for import of coronavirus medicine - indica News","indica News Bureau-  After a ban of nearly six years, the US Food and Drug Administration (FDA) has partially lifted an import alert on Ipca Laboratories' two labs in Madhya Pradesh, India, to ensure the supply","https://indicanews.com/2020/03/21/us-fda-to-lift-band-on-two-ipca-plants-in-india-for-import-of-coronavirus-medicine/","https://indicanews.com/wp-content/uploads/2020/03/Laboratories.jpg","2020-03-22T01:01:26Z"
"Indiatvnews.com","Coronavirus: COVID-19 virus stays for 3 days on plastic and stainless steel - India TV News","People may acquire the coronavirus through the air and after touching contaminated objects and this is the reason new cases are soaring globally. covid 19 plastic steel","https://www.indiatvnews.com/health/coronavirus-covid-19-virus-stays-3-days-plastic-stainless-steel-600301","https://resize.indiatvnews.com/en/resize/newbucket/715_-/2020/03/coronavirus-1584804700.jpg","2020-03-21T15:39:07Z"
"Greaterkashmir.com","Indian-origin team develops test to spot corona infection in 2 hrs - Greater Kashmir","Indian-origin team develops test to spot corona infection in 2 hrs Greater Kashmir | An Indian-origin team of researchers led by Dr Ravindra Kolhe from Georgia-based Augusta University has developed a novel, accurate coronavirus test that","https://www.greaterkashmir.com/news/world/indian-origin-team-develops-test-to-spot-corona-infection-in-2-hrs/","https://i2.wp.com/www.greaterkashmir.com/wp-content/uploads/2020/03/Virus-Negative.jpg?fit=1920%2C1080&ssl=1","2020-03-20T23:02:00Z"
