"SourceName","Title","Description","Url","UrlToImage","PublishedAt"
"Indianexpress.com","IIT Guwahati researchers developing vaccine for coronavirus - The Indian Express","The institute clarified, ""it is just a proof of concept and the work requires a thorough validation in cell culture and animal model before coming to any conclusion.""","https://indianexpress.com/article/education/coronavirus-vaccine-covid-news-iit-guwahati-researchers-developing-vaccine-for-coronavirus-6329575/","https://images.indianexpress.com/2020/03/coronavaccine759.jpg?w=759","2020-03-24T12:56:42Z"
"Google News","Coronavirus: Reliance gives India its first COVID-dedicated hospital in Maharashtra - The Financial Express","","https://news.google.com/__i/rss/rd/articles/CBMijQFodHRwczovL3d3dy5maW5hbmNpYWxleHByZXNzLmNvbS9saWZlc3R5bGUvaGVhbHRoL2Nvcm9uYXZpcnVzLXJlbGlhbmNlLWdpdmVzLWluZGlhLWl0cy1maXJzdC1jb3ZpZC1kZWRpY2F0ZWQtaG9zcGl0YWwtaW4tbWFoYXJhc2h0cmEvMTkwNzgyNC_SAZIBaHR0cHM6Ly93d3cuZmluYW5jaWFsZXhwcmVzcy5jb20vbGlmZXN0eWxlL2hlYWx0aC9jb3JvbmF2aXJ1cy1yZWxpYW5jZS1naXZlcy1pbmRpYS1pdHMtZmlyc3QtY292aWQtZGVkaWNhdGVkLWhvc3BpdGFsLWluLW1haGFyYXNodHJhLzE5MDc4MjQvbGl0ZS8?oc=5","","2020-03-24T10:57:31Z"
"Indiatoday.in","Covid-19: The bitter truth about using hydroxychloroquine as a preventive drug |India Today Insight - India Today","Did the Indian Council for Medical Research factor in the extreme side effects and easy availability of this antimalarial drug before recommending it for those who face a high risk of coronavirus infection?","https://www.indiatoday.in/india-today-insight/story/covid-19-the-bitter-truth-about-using-hydroxychloroquine-as-a-preventive-drug-1659116-2020-03-24","https://akm-img-a-in.tosshub.com/indiatoday/images/story/202003/gettyimages-1211148630-170667a-647x363.jpeg?b5YxegU5vlu845wVjw8DNvaZhwpSs2wW","2020-03-24T09:46:00Z"
"News18.com","Panic, Anxiety, Depression: What Coronavirus Lockdown Means for India's Mental Health - News18","While the COVID-19 outbreak has led to philosophical questions about survival, humanity and the future, the changes and the chaos that it is bringing in the lives of Indians are hard to cope with.","https://www.news18.com/news/buzz/panic-anxiety-depression-what-coronavirus-lockdown-means-for-indias-mental-health-2548869.html","https://images.news18.com/ibnlive/uploads/2020/03/Untitled-design-2019-10-11T120947.855.png","2020-03-24T07:34:21Z"
"The Times of India","Lockdowns not enough to defeat coronavirus: WHO's Ryan - Times of India","Rest of World News: Countries can’t simply lock down their societies to defeat coronavirus, the WHO’s top emergency expert Mike Ryan said on Sunday. ""What we really need","https://timesofindia.indiatimes.com/world/rest-of-world/lockdowns-not-enough-to-defeat-coronavirus-whos-ryan/articleshow/74766766.cms","https://static.toiimg.com/thumb/msid-74766754,width-1070,height-580,imgsize-42459,resizemode-75,overlay-toi_sw,pt-32,y_pad-40/photo.jpg","2020-03-23T06:36:37Z"
"India.com","Lockdowns Won't Combat Coronavirus Spread, Says WHO; Stresses on Strong Public Health Measures - India.com","The danger right now with the lockdowns,  if we don't put in place the strong public health measures now, when those movement restrictions and lockdowns are lifted, the danger is the disease will jump back up, a WHO expert said.","https://www.india.com/news/world/lockdowns-wont-combat-coronavirus-spread-says-who-stresses-on-strong-public-health-measures-3978085/","https://www.india.com/wp-content/uploads/2020/03/WHO-IANS-2.jpg","2020-03-23T03:20:32Z"
