"SourceName","Title","Description","Url","UrlToImage","PublishedAt"
"Pcmag.com","Snapchat's New Mental Health Tool Helps Ease Coronavirus Anxiety - PCMag India","'Here For You' provides resources from local experts when users search for sensitive topics such as anxiety, depression, grief, suicide, or bullying.","https://in.pcmag.com/social-networking/135523/snapchats-new-mental-health-tool-helps-ease-coronavirus-anxiety","https://sm.pcmag.com/t/pcmag_in/news/s/snapchats-/snapchats-new-mental-health-tool-helps-ease-coronavirus-anxi_m81n.1200.jpg","2020-03-20T14:34:00Z"
"Keralakaumudi.com","Indian-origin team develops test to spot corona infection in two hrs - കേരള കൌമുദി","NEW YORK: An Indian-origin team of researchers led by Dr Ravindra Kolhe from Georgia-based Augusta University has developed a novel, accurate coronavirus test that can tell patients if they are infected within about two hours, instead of waiting typically day…","https://keralakaumudi.com/en/news/news.php?id=267212&u","https://keralakaumudi.com/web-news/en/2020/03/NMAN0133175/image/tests.1.544140.jpg","2020-03-20T11:22:47Z"
"Indiatoday.in","Russia starts testing coronavirus vaccine prototypes on animals - India Today","Scientists around the world have warned that the development of a vaccine is a lengthy and complex process that might only yield something for broader use in the next 12-18 months.","https://www.indiatoday.in/world/story/russia-starts-testing-coronavirus-vaccine-prototypes-on-animals-1657835-2020-03-20","https://akm-img-a-in.tosshub.com/indiatoday/images/story/202003/RTS36EJW_1-647x363.jpeg?qYuB3inXQ4_yiVpvDN_okiIDn1DyTm4I","2020-03-20T09:37:07Z"
"Indiatvnews.com","Coronavirus Scare: Things you should keep in mind during home quarantine - India TV News","COVID 19 is an infectious disease which is caused by a recently discovered novel corona virus. It is transmitted when a person suffering from this disease sneezes or coughs, a lot of droplets spread in the air or fall on the ground and nearby surfaces.","https://www.indiatvnews.com/health/coronavirus-scare-things-you-should-keep-in-mind-during-home-quarantine-599888","https://resize.indiatvnews.com/en/resize/newbucket/715_-/2020/03/pjimage-2-1584688859.jpg","2020-03-20T07:27:22Z"
"Businessinsider.in","Tips to avoid coronavirus infection - Business Insider India","Coronavirus has already infected millions of people all over the globe. There is no vaccine available today to prevent coronavirus disease (COVID-19) The right","https://www.businessinsider.in/india/news/tips-to-avoid-coronavirus-infection/articleshow/74725686.cms","https://www.businessinsider.in/photo/74725686/tips-to-avoid-coronavirus-infection.jpg?imgsize=79285","2020-03-20T06:36:00Z"
"The Times of India","Coronavirus survivors list 12 telling symptoms of the disease - Times of India","The COVID-19 infection has been declared a pandemic which has led to worldwide lockdowns and an overall state of panic and fear. The virus presents itself with flu-like symptoms that include fever and dry cough. As doctors around the world are still grappling…","https://timesofindia.indiatimes.com/life-style/health-fitness/health-news/coronavirus-survivors-list-12-telling-symptoms-of-the-disease/photostory/74714459.cms","https://static.toiimg.com/photo/74714715.cms","2020-03-20T03:30:00Z"
"Bbc.com","Coronavirus: Why is India testing so little? - BBC News","India has one of the world’s lowest testing rates for coronavirus, and that is worrying many experts.","https://www.bbc.com/news/world-asia-india-51922204","https://ichef.bbci.co.uk/news/1024/branded_news/13D00/production/_111325118_mediaitem111325117.jpg","2020-03-20T00:41:34Z"
"The Times of India","Coronavirus in young people: Is it dangerous? Data show it can be - Times of India","Rest of World News: New evidence from Europe and the US suggests that younger adults aren’t as impervious to the novel coronavirus that’s circulating worldwide as origina","https://timesofindia.indiatimes.com/world/rest-of-world/coronavirus-in-young-people-is-it-dangerous-data-show-it-can-be/articleshow/74702745.cms","https://static.toiimg.com/thumb/msid-74702736,width-1070,height-580,imgsize-150504,resizemode-75,overlay-toi_sw,pt-32,y_pad-40/photo.jpg","2020-03-19T07:34:14Z"
