"SourceName","Title","Description","Url","UrlToImage","PublishedAt"
"The Times of India","India faces spike in coronavirus cases, says study - Times of India","India News: India could face between around 100,000 and 1.3 million confirmed cases of the disease caused by the new coronavirus by mid-May if it continues to spr","https://timesofindia.indiatimes.com/india/india-faces-spike-in-coronavirus-cases-says-study/articleshow/74784975.cms","https://static.toiimg.com/thumb/msid-74784955,width-1070,height-580,imgsize-130697,resizemode-75,overlay-toi_sw,pt-32,y_pad-40/photo.jpg","2020-03-24T07:07:32Z"
"Theprint.in","HIV drug combo approved by ICMR for coronavirus treatment fails clinical trials in China - ThePrint","Anti-HIV drugs Lopinavir and Ritonavir were administered to treat two Italian tourists in India who had tested positive for the coronavirus infection.","https://theprint.in/health/hiv-drug-combo-approved-by-icmr-for-coronavirus-treatment-fails-clinical-trials-in-china/386865/","https://d2c7ipcroan06u.cloudfront.net/wp-content/uploads/2020/03/coronavirus-DElhi-e1584604591641.jpg","2020-03-24T05:23:42Z"
"Indianexpress.com","Explained: Coronavirus tests needed, but each country has priorities, says molecular biologist Dr Jaya Shrivastava - The Indian Express","As community spread of the novel coronavirus in India looms, answers to some key questions over testing for the virus","https://indianexpress.com/article/explained/explained-coronavirus-india-testing-6328742/","https://images.indianexpress.com/2020/03/corona-testing-750.jpg?w=759","2020-03-24T01:06:27Z"
"The Times of India","How close are we to finding a cure for Corona? - Times of India","India News: In the race to find a cure for coronavirus, scientists from  all across the world are coming together and trying to find a specific drug or treatment","https://timesofindia.indiatimes.com/india/how-close-are-we-to-finding-a-cure-for-corona/articleshow/74768109.cms","https://static.toiimg.com/thumb/msid-74768109,width-1070,height-580,imgsize-1,resizemode-6,overlay-toi_sw,pt-32,y_pad-40/photo.jpg","2020-03-23T09:44:00Z"
"Huffingtonpost.in","Lockdowns Not Enough To Defeat Coronavirus, Says WHO's Emergency Expert - HuffPost India","World Health Organization’s top emergency expert on what every country needs to do to fight the Covid-19.","https://www.huffingtonpost.in/entry/lockdowns-coronavirus-fight-who_in_5e7838a0c5b62f90bc4d2d0c","https://img.huffingtonpost.com/asset/5e783a802400003300cea13d.jpeg?ops=1200_630","2020-03-23T04:37:41Z"
"Youtube.com","Services to be operational in lockdown in India | COVID-19 pandemic crisis | Coronavirus - WION","Lockdown is the most potent tool amid the coronavirus outbreak and as the government said there will be some inconvenience caused. WION would like to assure ...","https://www.youtube.com/watch?v=qgN9j17nPdU","https://i.ytimg.com/vi/qgN9j17nPdU/maxresdefault.jpg","2020-03-23T03:15:45Z"
"Scroll.in","Explainer: Battling coronavirus will take more than just buying ventilators for India’s hospitals - Scroll.in","There are many challenges. But there is hope, writes a doctor who has worked in an Intensive Care Unit.","https://scroll.in/pulse/956930/explainer-battling-coronavirus-will-take-more-than-just-buying-additional-ventilators-for-hospitals","https://s01.sgp1.cdn.digitaloceanspaces.com/book/138735-zrueopaqgt-1584892650.jpg","2020-03-22T16:20:00Z"
"Reuters","Lockdowns not enough to defeat coronavirus - WHO's Ryan - Reuters India","Countries can't simply lock down their societies to defeat coronavirus, the World Health Organization's top emergency expert said on Sunday, adding that public health measures are needed to avoid a resurgence of the virus later on.","https://in.reuters.com/article/health-coronavirus-who-ryan-idINKBN2190E2","https://s1.reutersmedia.net/resources/r/?m=02&d=20200322&t=2&i=1506606978&w=1200&r=LYNXMPEG2L09A","2020-03-22T12:28:43Z"
"Indiatvnews.com","As India observes 'janata curfew', WHO says lockdown not enough to defeat coronavirus - India TV News","WHO's Mike Ryan said that lockdown was dangerous in the sense that when it got lifted, the danger of coronavirus might resurface","https://www.indiatvnews.com/news/india/as-india-observes-janata-curfew-who-says-lockdown-not-enough-to-defeat-coronavirus-600514","https://resize.indiatvnews.com/en/resize/newbucket/715_-/2020/03/janata-curfew-1584875359.jpg","2020-03-22T11:30:05Z"
