"SourceName","Title","Description","Url","UrlToImage","PublishedAt"
"The Times of India","WHO's Mike Ryan feels lockdowns not enough to defeat coronavirus - Times of India","Lockdowns not enough to defeat coronavirus, says WHO's Ryan","https://timesofindia.indiatimes.com/life-style/health-fitness/health-news/whos-mike-ryan-feels-lockdowns-not-enough-to-defeat-coronavirus/articleshow/74770811.cms","https://static.toiimg.com/photo/msid-74770834/74770834.jpg?79285","2020-03-23T08:21:26Z"
"India.com","Lockdowns Won't Combat Coronavirus Spread, Says WHO; Stresses on Strong Public Health Measures - India.com","The danger right now with the lockdowns,  if we don't put in place the strong public health measures now, when those movement restrictions and lockdowns are lifted, the danger is the disease will jump back up, a WHO expert said.","https://www.india.com/news/world/lockdowns-wont-combat-coronavirus-spread-says-who-stresses-on-strong-public-health-measures-3978085/","https://www.india.com/wp-content/uploads/2020/03/WHO-IANS-2.jpg","2020-03-23T03:20:32Z"
"Newsheads.in","Covid 19: Indians crush social distancing, hit streets during Janta curfew against coronavirus - NEWS HEADS","The whole idea of Janta curfew went into the drain when some Indians misunderstood the call of clapping from their houses and came out on the streets without realizing that how they are putting themselves exposed to the virus responsible of taking several liv…","https://www.newsheads.in/lifestyle/news/covid-19-indians-crush-social-distancing-hit-streets-during-janta-curfew-against-coronavirus-article-60794","https://static.newsheads.in/media/thumbs/2020/03/23/363886431-street-celebration_1200x675.jpg","2020-03-23T01:04:35Z"
"Indiatoday.in","Lockdowns not enough to defeat coronavirus: WHO - India Today","Countries can't simply lock down their societies to defeat coronavirus, the World Health Organization's top emergency expert said, adding that public health measures are needed to avoid a resurgence of the virus later on.","https://www.indiatoday.in/world/story/lockdowns-not-enough-to-defeat-coronavirus-who-1658554-2020-03-23","https://akm-img-a-in.tosshub.com/indiatoday/images/story/202003/lockdown-647x363.jpeg?9kDPOaxHBBpBX8rlw5HCcOsqtc0H8EFp","2020-03-22T21:10:48Z"
"Thestatesman.com","‘Latitude link’ in Coronavirus spread; new cases in India could surge: IMSC Study - The Statesman","More findings on the latitudinal link to the spread of the virus may also help authorities customise their response and assist in preventing its dispersion, Prof Sitabhra Sinha said.","https://www.thestatesman.com/india/latitude-link-in-coronavirus-spread-new-cases-in-india-could-surge-imsc-study-1502868690.html","https://www.thestatesman.com/wp-content/uploads/2020/03/covid.jpg","2020-03-22T15:43:39Z"
"The Times of India","Woman With Coronavirus Says It's Like 'Having Glass In Your Lungs,' Calls Breathing A 'Battle' - India Times","Click here to read about a COVID-19 patient named Tara Jane Langston, who filmed herself in an intensive care unit (ICU) in Hillingdon Hospital, West London begging people not to take any chances when it comes to taking precautions against the virus.","https://www.indiatimes.com/trending/social-relevance/coronavirus-symptoms-explained-by-uk-woman-508930.html","https://im.indiatimes.in/content/2020/Mar/Coronavirus-patient-_5e75dc62547ef.jpg","2020-03-21T09:50:11Z"
"Themobileindian.com","WhatsApp and WHO create a chatbot to share reliable coronavirus info - The Mobile Indian","The new service is free to use and it is designed to answer questions from the public about Coronavirus.","https://www.themobileindian.com/news/whatsapp-and-who-create-a-chatbot-to-share-reliable-coronavirus-info-30311","https://www.themobileindian.com/public/thumbs/news/2020/03/30311/whatsapp_425_735.jpg","2020-03-21T08:02:00Z"
