SourceName,Title,Description,Url,UrlToImage,PublishedAt
"Euronews.com","How the new coronavirus could change our behaviour","The coronavirus is “ political gift for nativist nationalists and protectionists."" Here's how the pandemic could affect our culture and view of our world.","https://www.euronews.com/2020/03/15/how-the-new-coronavirus-could-change-our-behaviour","https://static.euronews.com/articles/stories/04/56/82/56/1000x563_cmsv2_46b721fa-de0a-5555-b40a-2997ecfff8b6-4568256.jpg","2020-03-15T14:18:05Z"
"Seattlepi.com","South Asian leaders call for cooperation on coronavirus","NEW DELHI (AP) - Leaders and officials from the eight South Asian nations held a video conference Sunday calling for closer cooperation to combat the spread of the coronavirus in the region, which is home to a fifth of the world's population. 
 Indian Prime M…","https://www.seattlepi.com/news/medical/article/South-Asian-leaders-call-for-cooperation-on-15132525.php","https://s.hdnux.com/photos/01/11/11/67/19176908/3/rawImage.jpg","2020-03-15T14:20:54Z"
"Thehindubusinessline.com","CAIT writes to FM seeking insurance cover for coronavirus-hit businesses","Traders’ body CAIT has appealed to Finance Minister Nirmala Sitharaman to direct regulator IRDAI to mandate insurance firms to introduce coverage for disruptions to businesses on account of the corona","https://www.thehindubusinessline.com/economy/cait-writes-to-fm-seeking-insurance-cover-for-coronavirus-hit-businesses/article31075304.ece","https://www.thehindubusinessline.com/static/theme/default/base/img/og-image.jpg","2020-03-15T14:25:15Z"
"Dw.com","Coronavirus latest: Germany to close some borders","German authorities have decided to close the country's borders with France, Austria and Switzerland. Commuters would still be allowed to travel, according to German media. Follow DW for the latest.","https://www.dw.com/en/coronavirus-latest-germany-to-close-some-borders-reports/a-52777896","https://www.dw.com/image/52781659_304.jpg","2020-03-15T14:28:10Z"
"Fox News","Tom Del Beccaro: Coronavirus is proof that US not ready for a serious disaster","The experience indicates one thing is for certain: America is not ready for a major national crisis,","https://www.foxnews.com/opinion/tom-del-beccaro-coronavirus-is-proof-that-us-not-ready-for-a-serious-disaster","https://static.foxnews.com/foxnews.com/content/uploads/2020/03/AP20075201522603.jpg","2020-03-15T14:32:26Z"
"Businesstoday.in","Coronavirus update: Noida administration launches dedicated email ID, 24x7 phone line for queries - Business Today","The Gautam Buddh Nagar administration has launched a dedicated email id dmgbncorona@gmail.com a day after opening a similar 24-hour telephonic helpline 0120 2569 901 to respond to queries related to the contagious novel coronavirus threat","https://www.businesstoday.in/top-story/coronavirus-update-noida-administration-launches-dedicated-email-id-24x7-phone-line-for-queries/story/398285.html","https://akm-img-a-in.tosshub.com/sites/btmt/images/stories/mobile_505x264_150320081234.jpg","2020-03-15T14:42:00Z"
