"SourceName","Title","Description","Url","UrlToImage","PublishedAt"
"Indianexpress.com","Amid shortage, IIT Hyderabad creates a sanitiser to fight coronavirus - The Indian Express","The sanitiser has been prepared by two female researchers who will make it available for the community. The duo informed that their creation aims to extend help during the health crisis and not gain from it commercially.","https://indianexpress.com/article/education/amid-shortage-iit-hyderabad-creates-own-sanitizer-to-fight-coronavirus-6320089/","https://images.indianexpress.com/2020/03/iit-h-759.jpg?w=759","2020-03-18T09:47:58Z"
"Qz.com","With 28 dead, India was already under a swine flu siege when coronavirus struck - Quartz India","The symptoms of H1N1 include fever, sore throat, runny nose, and cough.","https://qz.com/india/1819396/india-was-already-under-swine-flue-siege-when-coronavirus-struck/","https://cms.qz.com/wp-content/uploads/2020/03/AP_090813012946-e1584391360698.jpg?quality=75&strip=all&w=1400","2020-03-18T07:02:27Z"
"Indianexpress.com","Coronavirus outbreak: How to handle a dead patient - The Indian Express","The Health Ministry has issued guidelines for the disposal of bodies, while noting that an increased risk of infection from a dead body is unlikely.","https://indianexpress.com/article/explained/coronavirus-outbreak-how-to-handle-a-dead-patient-6319414/","https://images.indianexpress.com/2020/03/sepsis-7-1.jpg?w=759","2020-03-18T04:42:54Z"
"Indiatoday.in","Will rise in temperature affect coronavirus? AIIMS Director answers this and more - India Today","AIIMS Director Dr Randeep Guleria answers all questions related to the novel coronavirus (COVID-19).","https://www.indiatoday.in/india/story/aiims-director-dr-randeep-guleria-answers-all-questions-on-novel-coronavirus-covid-19-1656697-2020-03-18","https://akm-img-a-in.tosshub.com/indiatoday/images/story/202003/Thermal_scanning-647x363.jpeg?Ap0oetLFEHBs9toicTEk3VjhOJ8kqQNt","2020-03-18T02:23:10Z"
"The Times of India","Coronavirus: Why are there more male than female patients - Times of India","While the number of people infected is almost equal in number, it is the women who have a comparatively more surviv","https://timesofindia.indiatimes.com/life-style/health-fitness/health-news/coronavirus-why-are-there-more-male-than-female-patients/articleshow/74674351.cms","https://static.toiimg.com/photo/msid-74674351/74674351.jpg?510228","2020-03-17T16:42:59Z"
"Indiatoday.in","WHO confirms 2 coronavirus cases among its staff - India Today","The two cases are the first at the Geneva-based organisation and follow a confirmed case at the UN office in Geneva as well one at the World Trade Organization last week.","https://www.indiatoday.in/world/story/covid-19-who-confirm-coronavirus-cases-among-staff-1656516-2020-03-17","https://akm-img-a-in.tosshub.com/indiatoday/images/story/202003/coro_2-647x363.jpeg?QBycyMrhslRR9roh9vxhUQtm5qkB_BDu","2020-03-17T14:21:41Z"
"The Times of India","Some People Recovered From Coronavirus Are Testing Positive Again: Why This May Happen - India Times","Today COVID-19 has infected over 150,000 and claiming lives of over 6000. But today, over 73,000 people have recovered from the novel coronavirus. While this might sound like good new (and it surely is), reports around the world reveal that people around the …","https://www.indiatimes.com/technology/science-and-future/some-people-recovered-from-coronavirus-are-testing-positive-again-why-this-may-happen-508614.html","https://im.indiatimes.in/content/2020/Mar/Facebook-Image-2_5e70c3f5b9200.jpg","2020-03-17T12:21:12Z"
"Indiatoday.in","Coronavirus: Health Ministry recommends anti-HIV drug combination Lopinavir-Ritonavir on case-to-case basis - India Today","In its revised guidelines on the 'Clinical Management of COVID - 19' issued on Tuesday, the ministry recommended Lopinavir-Ritonavir for high-risk groups patients aged above 60, suffering from diabetes mellitus, renal failure, chronic lung disease and are imm…","https://www.indiatoday.in/india/story/coronavirus-health-ministry-recommends-anti-hiv-drug-combination-lopinavir-ritonavir-case-to-case-basis-1656488-2020-03-17","https://akm-img-a-in.tosshub.com/indiatoday/images/story/202003/HIV_DRUG_PILLS_MEDI_REUTERS-647x363.jpeg?z95Tkv_.Y3EHGMoozVwCv0B1ZdSc5vif","2020-03-17T11:21:03Z"
"Businessinsider.in","11 extreme measures China took to contain the coronavirus show the rest of the world is unprepared for COVID-1 - Business Insider India","ReutersVolunteers wearing face masks stand next to vegetables to be delivered to residents of a residential area in Wuhan.In China, where the novel coronavirus","https://www.businessinsider.in/science/news/11-extreme-measures-china-took-to-contain-the-coronavirus-show-the-rest-of-the-world-is-unprepared-for-covid-19/articleshow/74660747.cms","https://www.businessinsider.in/photo/74660747/11-extreme-measures-china-took-to-contain-the-coronavirus-show-the-rest-of-the-world-is-unprepared-for-covid-19.jpg","2020-03-16T16:16:00Z"
