"SourceName","Title","Description","Url","UrlToImage","PublishedAt"
"The Times of India","Google’s dedicated website for coronavirus launches - Times of India","Tech giant Google has finally launched its COVID-19 Information & Resources website. The objective of this website is to offer prevention, education a","https://timesofindia.indiatimes.com/gadgets-news/googles-dedicated-website-for-coronavirus-launches/articleshow/74752424.cms","https://static.toiimg.com/thumb/msid-74752411,width-1070,height-580,imgsize-130107,resizemode-75,overlay-toi_sw,pt-32,y_pad-40/photo.jpg","2020-03-21T17:07:53Z"
"The Times of India","This American Woman Sadly Lost Her Mother, Two Brothers & Sister To Coronavirus Within A Week - Indiatimes.com","Elizabeth Fusco, lost her mother, two brothers and a sister to deadly coronavirus. Her mother and the family matriarch, Grace Fusco, 73, of Freehold, New Jersey, died Wednesday this week after being diagnosed with the coronavirus.","https://www.indiatimes.com/news/india/this-american-woman-sadly-lost-her-mother-two-brothers-sister-to-coronavirus-within-a-week-508912.html","https://im.indiatimes.in/content/2020/Mar/FBImage3-9_5e75b6ff25758.jpg","2020-03-21T10:23:48Z"
"Telanganatoday.com","ICMR revises testing strategy to fight spread of new coronavirus - Telangana Today","New Delhi: The Indian Council of Medical Research revised its strategy to fight the spread of the new coronavirus on Saturday, saying all hospitalised patients with severe acute respiratory illness, shortness of breath and having fever and cough will now be t…","https://telanganatoday.com/icmr-revises-testing-strategy-to-fight-spread-of-new-coronavirus","https://cdn.telanganatoday.com/im/Telangana-Today-News.jpg","2020-03-21T06:21:00Z"
"Greaterkashmir.com","Indian-origin team develops test to spot corona infection in 2 hrs - Greater Kashmir","Indian-origin team develops test to spot corona infection in 2 hrs Greater Kashmir | An Indian-origin team of researchers led by Dr Ravindra Kolhe from Georgia-based Augusta University has developed a novel, accurate coronavirus test that","https://www.greaterkashmir.com/news/world/indian-origin-team-develops-test-to-spot-corona-infection-in-2-hrs/","https://i2.wp.com/www.greaterkashmir.com/wp-content/uploads/2020/03/Virus-Negative.jpg?fit=1920%2C1080&ssl=1","2020-03-20T23:02:00Z"
"Yahoo.com","Coronavirus: Why is India testing so little? - Yahoo News","India has one of the world’s lowest testing rates for coronavirus, and that is worrying many experts.","https://news.yahoo.com/coronavirus-why-india-testing-little-003950769.html","https://s.yimg.com/ny/api/res/1.2/bhw8G1r1VxKUChQG9Y7q6g--/YXBwaWQ9aGlnaGxhbmRlcjt3PTEyODA7aD03MjA-/https://s.yimg.com/uu/api/res/1.2/jptVrjy5iTxW__RyxK9opw--~B/aD00MzI7dz03Njg7c209MTthcHBpZD15dGFjaHlvbg--/https://media.zenfs.com/en-gb/bbc_us_articles_995/d1a621bf67d6acf6fcda5bb026205668","2020-03-20T11:06:00Z"
"The Times of India","Coronavirus survivors list 12 telling symptoms of the disease - Times of India","The COVID-19 infection has been declared a pandemic which has led to worldwide lockdowns and an overall state of panic and fear. The virus presents itself with flu-like symptoms that include fever and dry cough. As doctors around the world are still grappling…","https://timesofindia.indiatimes.com/life-style/health-fitness/health-news/coronavirus-survivors-list-12-telling-symptoms-of-the-disease/photostory/74714459.cms","https://static.toiimg.com/photo/74714715.cms","2020-03-20T03:30:00Z"
"Businessinsider.in","Bill Gates says US lockdowns should have come sooner to slow the coronavirus' spread, and that social distanci - Business Insider India","Mike Cohen/Getty Images for The New York TimesBill Gates.Bill Gates participated in a Reddit AMA about the coronavirus pandemic on Wednesday, fielding questions","https://www.businessinsider.in/science/news/bill-gates-says-us-lockdowns-should-have-come-sooner-to-slow-the-coronavirus-spread-and-that-social-distancing-can-get-the-cases-down-to-low-levels/articleshow/74721422.cms","https://www.businessinsider.in/photo/74721422/bill-gates-says-us-lockdowns-should-have-come-sooner-to-slow-the-coronavirus-spread-and-that-social-distancing-can-get-the-cases-down-to-low-levels.jpg","2020-03-19T23:52:00Z"
