"SourceName","Title","Description","Url","UrlToImage","PublishedAt"
"Livemint.com","Three Indians among 42 new coronavirus cases reported in Singapore - Livemint","Of the new cases, 24 are imported and have a travel history to Europe, North America, Middle East, ASEAN and other parts of Asia, the ministry said in a press release","https://www.livemint.com/news/india/three-indians-among-42-new-coronavirus-cases-reported-in-singapore-11585510122501.html","https://images.livemint.com/img/2020/03/29/600x338/2020-03-19T080421Z_3_LYNXMPEG2H0S2_RTROPTP_3_HEALTH-CORONAVIRUS_1584705100855_1585510258622.JPG","2020-03-29T19:36:51Z"
"Hindustantimes.com","Top Indian scientists join global fight against coronavirus - Hindustan Times","The National Institute of Immunology in Delhi will sequence the virus to see whether the one  infecting travellers from different parts of the world is the same or has undergone changes.","https://www.hindustantimes.com/india-news/top-indian-scientists-join-global-fight-against-virus/story-CKRGfycsjBJD2ypLcbJPHM.html","https://www.hindustantimes.com/rf/image_size_960x540/HT/p2/2020/03/30/Pictures/virus-outbreak-mississippi_da1fa804-7223-11ea-b308-ad7e0b841a10.jpg","2020-03-29T19:13:55Z"
"Newindianexpress.com","Wear masks even inside your homes, Chennai Corporation advises people in nine coronavirus-hit localities - The New Indian Express","The officials issued the advice to people living in areas where confirmed cases of COVID 19 reported so far in the city.","https://www.newindianexpress.com/cities/chennai/2020/mar/29/wear-masks-even-inside-your-homes-chennai-corporation-advises-people-in-nine-coronavirus-hit-localit-2123065.html","https://images.newindianexpress.com/uploads/user/imagelibrary/2020/3/29/w600X390/coronavirus_masks--_EPS.jpg","2020-03-29T11:53:00Z"
"Indiatvnews.com","Test at home for coronavirus infection in 10 minutes, NIV Pune approves Singapore company's test kit - India TV News","The Singapore-based company claims that its test kit can test the COVID-19 in 10 minutes from home. In the present circumstances this kit can provide relief to millions who fear corona virus.","https://www.indiatvnews.com/health/test-at-home-for-coronavirus-infection-in-10-minutes-niv-pune-approves-singapore-company-s-test-kit-602488","https://resize.indiatvnews.com/en/resize/newbucket/715_-/2020/03/coronavirus-test-kit-1585457017.jpg","2020-03-29T05:32:02Z"
"The Times of India","A heart attack? No, it was coronavirus - Times of India","US News: The 64-year-old patient arrived at a hospital in the New York City with symptoms looking like those seen in patients having a serious heart attack.","https://timesofindia.indiatimes.com/world/us/a-heart-attack-no-it-was-coronavirus/articleshow/74868933.cms","https://static.toiimg.com/thumb/msid-47529300,width-1070,height-580,imgsize-110164,resizemode-75,overlay-toi_sw,pt-32,y_pad-40/photo.jpg","2020-03-29T04:12:00Z"
"The Times of India","Novel coronavirus may get efficient at infecting humans during early phase: NIV - Times of India","Pune: The novel coronavirus — SARS-CoV-2 — can adapt to survive and may become “more efficient” at infecting humans during the “initial phase of its o.","https://timesofindia.indiatimes.com/city/pune/novel-coronavirus-may-get-efficient-at-infecting-humans-during-early-phase-niv/articleshow/74868387.cms","https://static.toiimg.com/thumb/msid-74868386,width-1070,height-580,imgsize-31893,resizemode-75,overlay-toi_sw,pt-32,y_pad-40/photo.jpg","2020-03-28T23:14:00Z"
"Telegraphindia.com","Coronavirus, pregnancy, and in vitro fertilisation - Telegraph India","Necessary to consider the impact that this disease may have on maternal and fetal well-being and eventual pregnancy outcome","https://www.telegraphindia.com/calcutta/coronavirus-pregnancy-and-in-vitro-fertilisation/cid/1760108","https://static.telegraphindia.com/derivative/THE_TELEGRAPH/1760108/2X1/imageab1d67d1-3d4a-44cb-b561-ccc00e83ac29.jpg?v=0","2020-03-28T20:42:02Z"
"Yahoo.com","Coronavirus deaths in UK jump by highest amount to date to 1,019 - Yahoo India News","The number was up from 759 the previous day.","https://in.news.yahoo.com/coronavirus-deaths-uk-covid-19-141400090.html","https://s.yimg.com/uu/api/res/1.2/Hsb0nnYxHLkKdKq2ByKB2w--~B/aD0zMjgwO3c9NDkyODtzbT0xO2FwcGlkPXl0YWNoeW9u/https://media-mbst-pub-ue1.s3.amazonaws.com/creatr-images/2020-03/51501bb0-70fe-11ea-bf76-1a43181072df","2020-03-28T14:14:00Z"
