"SourceName","Title","Description","Url","UrlToImage","PublishedAt"
"Yahoo.com","Prominent Indian-origin virologist in South Africa dies from coronavirus - Yahoo India News","Johannesburg, Apr 1 (PTI) World-renowned virologist Gita Ramjee has become the first Indian-origin South African to have died after contracting the novel coronavirus that has killed five people in the country.","https://in.news.yahoo.com/prominent-indian-origin-virologist-south-232038832.html","https://s.yimg.com/cv/apiv2/social/images/yahoo_default_logo.png","2020-03-31T23:20:00Z"
"Indiatoday.in","Coronavirus: In fresh guidelines, health ministry recommends anti-malarial drug for Covid-19 - India Today","Bijnor Superintendent of Police (Rural) said the police picked up eight Indonesian Islamic preachers, who had attended the Nizamuddin 'markaz' on March 13, from a mosque in Nagina block of the district.","https://www.indiatoday.in/india/story/coronavirus-fresh-guidelines-health-ministry-recommends-anti-malarial-drug-covid-19-1661941-2020-04-01","https://akm-img-a-in.tosshub.com/indiatoday/images/story/202004/Coviefddf.jpeh-647x363.jpeg?Qfk8DugV9adNLv6VpiQuP1HEKPnrl.I7","2020-03-31T19:04:04Z"
"Oneindia.com","Coronavirus linked to cardiac injury even in patients without heart conditions - Oneindia","COVID-19 can cause cardiac injury even in patients without underlying heart conditions, and have fatal consequences for people with cardiovascular disease, according to a review of studies.","https://www.oneindia.com/international/coronavirus-linked-to-cardiac-injury-even-in-patients-without-heart-conditions-3061458.html","https://www.oneindia.com/img/2020/03/coronavirus20-1585560372.jpg","2020-03-31T06:25:06Z"
"Hindustantimes.com","Coronavirus: Indian government’s MyGov app has some myth-busters for you - Hindustan Times","The Indian government’s MyGov app is doing its bit in fighting fake news and misinformation on coronavirus by stating some ‘myth-busters’.","https://www.hindustantimes.com/tech/coronavirus-indian-government-s-mygov-app-has-some-myth-busters-for-you/story-G5tNTUb1JZuAHV0GUPqZrM.html","https://www.hindustantimes.com/rf/image_size_960x540/HT/p2/2020/03/30/Pictures/outbreak-fremont-the-coronavirus-disease-covid-california_0aff36d8-7215-11ea-b308-ad7e0b841a10.jpg","2020-03-31T05:57:02Z"
"Morungexpress.com","Coronavirus epidemic 'far from over' in Asia: WHO official - Morung Express","Men wearing protective masks sit inside a bus that will take them to a quarantine facility, amid concerns about the spread of coronavirus disease (COVID-19), in Nizamuddin area of New Delhi, India, March 31, 2020. REUTERS/Adnan Abidi

 

BEIJING, March 31 (Re…","http://morungexpress.com/coronavirus-epidemic-far-over-asia-who-official","http://morungexpress.com/sites/default/files/field/image/2020-03-31T044857Z_1_LYNXMPEG2U0DY_RTROPTP_4_HEALTH-CORONAVIRUS-SOUTHASIA.JPG","2020-03-31T05:17:42Z"
