"SourceName","Title","Description","Url","UrlToImage","PublishedAt"
"Scoopwhoop.com","The 4 Stages Of Coronavirus & Where We Stand Right Now - ScoopWhoop","According to the researchers there are four stages of the Novel Coronavirus and India is currently believed to be at Stage 2.","https://www.scoopwhoop.com/news/stages-of-coronavirus/","https://s3.scoopwhoop.com/anj2/5e7a09c12f1b744994416d3c/ef297522-f034-4ff9-855a-e73f2feff696.jpg","2020-03-24T14:27:27Z"
"Indiatoday.in","Coronavirus: Testing blunders crippled US response - India Today","US health officials and others have pointed to four primary issues that together hampered the national response: the early decision not to use the test adopted by the WHO, flaws with the more complex test developed by the CDC, government guidelines restrictin…","https://www.indiatoday.in/world/story/coronavirus-us-testing-blunders-1659236-2020-03-24","https://akm-img-a-in.tosshub.com/indiatoday/images/story/202003/AP20083777444227__1_-647x363.jpeg?FThEjXh5Fr25ViQbPfzrNp1L7Mqzpe_c","2020-03-24T14:13:52Z"
"The Times of India","Coronavirus: Is COVID-19 airborne? We clear the myth - Times of India","With coronavirus rapidly spreading its claws around the world, there is already a lot of rumors which have made the","https://timesofindia.indiatimes.com/life-style/health-fitness/health-news/coronavirus-is-covid-19-airborne-we-clear-the-myth/articleshow/74788540.cms","https://static.toiimg.com/thumb/msid-74788706,width-1070,height-580,overlay-toi_sw,pt-32,y_pad-40,resizemode-75,imgsize-526333/74788706.jpg","2020-03-24T11:53:26Z"
"Google News","Coronavirus: Reliance gives India its first COVID-dedicated hospital in Maharashtra - The Financial Express","","https://news.google.com/__i/rss/rd/articles/CBMijQFodHRwczovL3d3dy5maW5hbmNpYWxleHByZXNzLmNvbS9saWZlc3R5bGUvaGVhbHRoL2Nvcm9uYXZpcnVzLXJlbGlhbmNlLWdpdmVzLWluZGlhLWl0cy1maXJzdC1jb3ZpZC1kZWRpY2F0ZWQtaG9zcGl0YWwtaW4tbWFoYXJhc2h0cmEvMTkwNzgyNC_SAZIBaHR0cHM6Ly93d3cuZmluYW5jaWFsZXhwcmVzcy5jb20vbGlmZXN0eWxlL2hlYWx0aC9jb3JvbmF2aXJ1cy1yZWxpYW5jZS1naXZlcy1pbmRpYS1pdHMtZmlyc3QtY292aWQtZGVkaWNhdGVkLWhvc3BpdGFsLWluLW1haGFyYXNodHJhLzE5MDc4MjQvbGl0ZS8?oc=5","","2020-03-24T10:57:31Z"
"Indiatoday.in","Covid-19: The bitter truth about using hydroxychloroquine as a preventive drug |India Today Insight - India Today","Did the Indian Council for Medical Research factor in the extreme side effects and easy availability of this antimalarial drug before recommending it for those who face a high risk of coronavirus infection?","https://www.indiatoday.in/india-today-insight/story/covid-19-the-bitter-truth-about-using-hydroxychloroquine-as-a-preventive-drug-1659116-2020-03-24","https://akm-img-a-in.tosshub.com/indiatoday/images/story/202003/gettyimages-1211148630-170667a-647x363.jpeg?b5YxegU5vlu845wVjw8DNvaZhwpSs2wW","2020-03-24T09:46:00Z"
"News18.com","Panic, Anxiety, Depression: What Coronavirus Lockdown Means for India's Mental Health - News18","While the COVID-19 outbreak has led to philosophical questions about survival, humanity and the future, the changes and the chaos that it is bringing in the lives of Indians are hard to cope with.","https://www.news18.com/news/buzz/panic-anxiety-depression-what-coronavirus-lockdown-means-for-indias-mental-health-2548869.html","https://images.news18.com/ibnlive/uploads/2020/03/Untitled-design-2019-10-11T120947.855.png","2020-03-24T07:34:21Z"
"Youtube.com","Icmr approves use of an anti-malarial drug for health workers | Covid-19 | Coronavirus India - WION","ICMR approves use of an anti-malarial drug for health workers | Covid-19 | Coronavirus India Icmr approves use of anti-malarial drug in high risk. ICMR holds...","https://www.youtube.com/watch?v=lCZ0236IKKI","https://i.ytimg.com/vi/lCZ0236IKKI/maxresdefault.jpg","2020-03-23T12:13:42Z"
