"SourceName","Title","Description","Url","UrlToImage","PublishedAt"
"Theprint.in","One coronavirus patient infects 1.7 people in India, much lower than in China, Italy: Study - ThePrint","Study by Institute of Mathematical Sciences in Chennai explains slow spread of COVID-19 cases in India, but there is still no clarity on reasons for low reproduction number.","https://theprint.in/health/one-coronavirus-patient-infects-1-7-people-in-india-much-lower-than-in-china-italy-study/383538/","https://d2c7ipcroan06u.cloudfront.net/wp-content/uploads/2020/03/corona4.jpg","2020-03-19T07:12:05Z"
"Indiatoday.in","China eyes end to coronavirus, plays down warnings of 'second wave' - India Today","As the pandemic continues to spread overseas, a growing number of countries are bracing themselves for a worst-case scenario in which COVID-19 remains in circulation until next year at the earliest.","https://www.indiatoday.in/world/story/china-eyes-end-to-coronavirus-plays-down-warnings-of-second-wave-1657336-2020-03-19","https://akm-img-a-in.tosshub.com/indiatoday/images/story/202003/corona_tawian_ap_1-647x363.jpeg?opeYe9uXWiVsDn_.jjZvKWLtMVEfUnWB","2020-03-19T07:07:02Z"
"Businessinsider.in","Bill Gates says healthcare workers may get a coronavirus shot within 18 months as scientists race to develop a - Business Insider India","Mike Cohen/Getty Images for The New York TimesBill Gates predicted on Reddit that healthcare professionals and other critical workers could start getting a","https://www.businessinsider.in/science/news/bill-gates-says-healthcare-workers-may-get-a-coronavirus-shot-within-18-months-as-scientists-race-to-develop-a-vaccine/articleshow/74701609.cms","https://www.businessinsider.in/photo/74701609/bill-gates-says-healthcare-workers-may-get-a-coronavirus-shot-within-18-months-as-scientists-race-to-develop-a-vaccine.jpg","2020-03-18T20:54:00Z"
"Moneycontrol.com","Indian guru Ramdev's tips to ward off coronavirus anger health professionals - Moneycontrol","There are currently no vaccines or drugs approved to treat or prevent COVID-19, only investigational COVID-19 vaccines and treatments under development.","https://www.moneycontrol.com/news/trends/health-trends/indian-guru-ramdevs-tips-to-ward-off-coronavirus-anger-health-professionals-5048251.html","https://static-news.moneycontrol.com/static-mcnews/2020/03/Baba-Ramdev-770x433.jpg","2020-03-18T15:38:10Z"
"Yahoo.com","How long can coronavirus live on surfaces? - Yahoo India News","Find out how long the virus can live on door handles, your handbag, and more.","https://in.style.yahoo.com/how-long-coronavirus-live-on-surfaces-handbag-clothes-door-handles-054301882.html","https://s.yimg.com/ny/api/res/1.2/yb8Z9.e.xNHbwN3ECHNsWw--~A/YXBwaWQ9aGlnaGxhbmRlcjt3PTk3NjtoPTU0OTtzbT0xO2lsPXBsYW5l/https://media-mbst-pub-ue1.s3.amazonaws.com/creatr-uploaded-images/2020-03/78cb8990-68ac-11ea-bfdf-62e3ce196150.cf.jpg","2020-03-18T05:55:49Z"
"Indiatoday.in","Will rise in temperature affect coronavirus? AIIMS Director answers this and more - India Today","AIIMS Director Dr Randeep Guleria answers all questions related to the novel coronavirus (COVID-19).","https://www.indiatoday.in/india/story/aiims-director-dr-randeep-guleria-answers-all-questions-on-novel-coronavirus-covid-19-1656697-2020-03-18","https://akm-img-a-in.tosshub.com/indiatoday/images/story/202003/Thermal_scanning-647x363.jpeg?Ap0oetLFEHBs9toicTEk3VjhOJ8kqQNt","2020-03-18T02:23:10Z"
"The Times of India","How to protect yourself from coronavirus health scams - Times of India","With several fake products and claims of coronavirus cure in the market, it is the innocent consumers who often fal","https://timesofindia.indiatimes.com/life-style/health-fitness/health-news/how-to-protect-yourself-from-coronavirus-health-scams/articleshow/74673647.cms","https://static.toiimg.com/photo/msid-74673647/74673647.jpg?185417","2020-03-17T16:42:53Z"
