"SourceName","Title","Description","Url","UrlToImage","PublishedAt"
"Indianexpress.com","IIT Guwahati researchers developing vaccine for coronavirus - The Indian Express","The institute clarified, ""it is just a proof of concept and the work requires a thorough validation in cell culture and animal model before coming to any conclusion.""","https://indianexpress.com/article/education/coronavirus-vaccine-covid-news-iit-guwahati-researchers-developing-vaccine-for-coronavirus-6329575/","https://images.indianexpress.com/2020/03/coronavaccine759.jpg?w=759","2020-03-24T12:56:42Z"
"Youtube.com","Doctor explains: How can cancer patients keep coronavirus away? - TNIE Videos","Dr Vijay from #AsterHospitals spoke to TNIE about what precautions cancer patients should take during coronavirus. #CoronavirusOutbreak #CcoronavirusIndia #C...","https://www.youtube.com/watch?v=eCWnn9JcLoc","https://i.ytimg.com/vi/eCWnn9JcLoc/maxresdefault.jpg","2020-03-24T12:34:31Z"
"Indiatvnews.com","Coronavirus: All your questions on COVID-19 answered - India TV News","coronavirus, coronavirus FAQs, coronavirus questions, coronavirus india, coronavirus precautions, coronavirus care, coronavirus medicine, coronavirus cure, coronavirus treatment, coronavirus drug, coronavirus remedy,","https://www.indiatvnews.com/fyi/faqs-coronavirus-covid-19-answered-by-doctors-experts-600974","https://resize.indiatvnews.com/en/resize/newbucket/715_-/2020/03/corona-update-1585030455.jpg","2020-03-24T09:37:09Z"
"News18.com","Panic, Anxiety, Depression: What Coronavirus Lockdown Means for India's Mental Health - News18","While the COVID-19 outbreak has led to philosophical questions about survival, humanity and the future, the changes and the chaos that it is bringing in the lives of Indians are hard to cope with.","https://www.news18.com/news/buzz/panic-anxiety-depression-what-coronavirus-lockdown-means-for-indias-mental-health-2548869.html","https://images.news18.com/ibnlive/uploads/2020/03/Untitled-design-2019-10-11T120947.855.png","2020-03-24T07:34:21Z"
"Livemint.com","Coronavirus patients above 50 years with pre-existing diseases most vulnerable - Livemint","Those aged under 50 comprise less than 1% of mortality due to coronavirus.The number of coronavirus patients are touching 500 in India","https://www.livemint.com/news/india/coronavirus-patients-above-50-years-with-pre-existing-diseases-most-vulnerable-11585032409450.html","https://images.livemint.com/img/2020/03/24/600x338/8af20fa9d6f048aa91cbbe57628e8c82-8af20fa9d6f048aa91cbbe57628e8c82-1_1585033328006_1585033465315.jpg","2020-03-24T07:05:33Z"
"Indianexpress.com","Lockdowns not enough to defeat coronavirus: WHO’s emergency expert - The Indian Express","""The danger right now with the lockdowns ... if we don't put in place the strong public health measures now, when those movement restrictions and lockdowns are lifted, the danger is the disease will jump back up,"" the WHO representative said.","https://indianexpress.com/article/coronavirus/lockdowns-not-enough-to-defeat-coronavirus-whos-emergency-expert-6327334/","https://images.indianexpress.com/2020/03/Noida-lockdown.jpeg?w=759","2020-03-23T02:36:09Z"
