"SourceName","Title","Description","Url","UrlToImage","PublishedAt"
"Indiatoday.in","Can blood from coronavirus survivors treat the newly ill? - India Today","Doctors in China attempted the first COVID-19 treatments using what the history books call ""convalescent serum"" -- today, known as donated plasma","https://www.indiatoday.in/world/story/can-blood-from-coronavirus-survivors-treat-the-newly-ill-1659537-2020-03-25","https://akm-img-a-in.tosshub.com/indiatoday/images/story/202003/CHINA_0-647x363.jpeg?F7VSOot9lxRKTLXw9OkjGNX0iGeeitrW","2020-03-25T09:53:25Z"
"News18.com","4.5 Lakh May Need ICU Admissions in Delhi Alone: ICMR Study Shows India’s Best and Worst Case Scenarios - News18","The study, published in the Indian Journal of Medical Research, was based on mathematical modelling and it predicted that controlling the spread of coronavirus would be difficult in “pessimist” scenarios in cities.","https://www.news18.com/news/india/4-5-lakh-may-need-icu-admissions-in-delhi-alone-icmr-study-shows-indias-best-and-worst-case-scenarios-2550541.html","https://images.news18.com/ibnlive/uploads/2020/03/Coronavirus-Mumbai2.jpg","2020-03-25T09:37:40Z"
"The Times of India","First known US child coronavirus death was teen 'in good health' - Times of India","US News: he first known death of a child due to the novel coronavirus in the United States was a teenager in previously good health, Los Angeles Mayor Eric Gar","https://timesofindia.indiatimes.com/world/us/first-known-us-child-coronavirus-death-was-teen-in-good-health/articleshow/74802515.cms","https://static.toiimg.com/thumb/msid-74802592,width-1070,height-580,imgsize-88370,resizemode-75,overlay-toi_sw,pt-32,y_pad-40/photo.jpg","2020-03-25T06:18:16Z"
"Hindustantimes.com","Indian govt to launch CoWin-20 app to help curb spread of coronavirus: Report - Hindustan Times","CoWin-20 smartphone app is currently in beta testing for both Android and iOS platforms.","https://www.hindustantimes.com/tech/indian-govt-to-launch-cowin-20-app-to-help-curb-spread-curb-of-coronavirus-report/story-aZnegkOzTGHgyoRAdpwmNM.html","https://www.hindustantimes.com/rf/image_size_960x540/HT/p2/2020/03/25/Pictures/virus-outbreak-india_0b5f8e26-6e4f-11ea-9530-7febd198d354.jpg","2020-03-25T04:15:31Z"
"Scoopwhoop.com","The 4 Stages Of Coronavirus & Where We Stand Right Now - ScoopWhoop","According to the researchers there are four stages of the Novel Coronavirus and India is currently believed to be at Stage 2.","https://www.scoopwhoop.com/news/stages-of-coronavirus/","https://s3.scoopwhoop.com/anj2/5e7a09c12f1b744994416d3c/ef297522-f034-4ff9-855a-e73f2feff696.jpg","2020-03-24T14:27:27Z"
