"SourceName","Title","Description","Url","UrlToImage","PublishedAt"
"Indiatoday.in","This Korean series predicted coronavirus outbreak 2 years ago. Uncanny similarities - India Today","A Korean series predicted the novel coronavirus outbreak 2 years ago. The uncanny similarities will blow your mind.","https://www.indiatoday.in/trending-news/story/this-korean-series-predicted-coronavirus-outbreak-2-years-ago-uncanny-similarities-1660001-2020-03-26","https://akm-img-a-in.tosshub.com/indiatoday/images/story/202003/BeFunky-collage_4-647x363.jpeg?xzahqnAyX3teOIAW0IvcBCkVu0StXnMR","2020-03-26T12:06:25Z"
"Kalingatv.com","National Health Mission guidelines for health care workers - Kalinga TV","New Delhi: India is at a very crucial stage in its fight against the transmission of coronavirus at community level. In this backdrop, the National Health Mission (NHM) has advised health workers, who are part of the primary health care (PHC) team, t","https://kalingatv.com/nation/national-health-mission-guidelines-for-health-care-workers/","https://cdn.kalingatv.com/wp-content/uploads/2020/03/health-care-workers-The-Verge.jpg","2020-03-26T11:51:00Z"
"Theprint.in","ICMR answers Covid-19 related queries for people with hypertension, diabetes, heart diseases - ThePrint","ICMR, the country apex medical research body, has answered a list of FAQs on the novel coronavirus that infected more than 600 in India.","https://theprint.in/health/icmr-answers-covid-19-related-queries-for-people-with-hypertension-diabetes-heart-diseases/388601/","https://d2c7ipcroan06u.cloudfront.net/wp-content/uploads/2020/03/Masks-1.jpg","2020-03-26T07:35:40Z"
"Youtube.com","Coronavirus cases in India rise to 606 | Death toll stand at 10 | COVID-19 - WION","India has seen a huge rise in the number of coronavirus cases with the total number of confirmed cases now rising to 606. The death toll in the country stand...","https://www.youtube.com/watch?v=a5Wkon0PM8k","https://i.ytimg.com/vi/a5Wkon0PM8k/maxresdefault.jpg","2020-03-26T02:30:43Z"
"Indiablooms.com","Coronavirus: Man dies, his wife critical after taking chloroquine phosphate - indiablooms","Phoenix/IBNS: An Arizona man died and his wife is under critical condition after they took chloroquine phosphate apparently to protect themselves from COVID-19, said a Times Now report.","https://www.indiablooms.com/world-details/USN/23584/coronavirus-man-dies-his-wife-critical-after-taking-chloroquine-phosphate.html","https://www.indiablooms.com/world_pic/2020/coronavirus-test-1585135108.jpg","2020-03-25T11:20:33Z"
"Indiatoday.in","India faces spike in coronavirus cases, says study, in test for health system - India Today","The total number of confirmed coronavirus cases in India has crossed the 570-mark. With another patient passing away in Tamil Nadu, India has now reported 11 Covid-19 deaths.","https://www.indiatoday.in/india/story/india-faces-spike-coronavirus-cases-1659412-2020-03-25","https://akm-img-a-in.tosshub.com/indiatoday/images/story/202003/Coronavirus_17-647x363.jpeg?93W.yBt1P999BP8LKI63h2BH7feRABEY","2020-03-25T05:19:25Z"
